Issue ID,Issue Title,Description,Issue URL,Project,Status,Priority,Component,Version,Created,wcag_sc,ai_wcag,acr_note,dev_note,thread_tldr,thread_problem,thread_sentiment,thread_timeline,thread_links
3361370,Untranslatable fields on translations of nodes are not marked for Language of Parts,Untranslatable fields on translations of nodes are not marked for Language of Parts,https://www.drupal.org/project/drupal/issues/3361370,drupal,Active,Normal,language system,11.x-dev,2 years 7 months,3.1.2,3.1.2,"Users attempting to translate content via the system’s translation interface may encounter discrepancies if untranslated fields are not correctly identified as requiring translation. This can lead to content being unnecessarily translated, disrupting the user's workflow and potentially misrepresenting the original meaning.","This issue indicates a problem with the metadata associated with translated nodes. The system needs to correctly mark fields designated as “untranslatable” within the translation itself, specifically using the ""Language of Parts"" property.  This allows translation tools to properly respect these boundaries.","The issue reports that fields marked as untranslatable on node translations are not being correctly tagged with the “Language of Parts” attribute, potentially impacting accessibility for users relying on translation features. The issue is currently stalled with no recent activity or proposed solutions.",Charles Belov reported that fields on translations of nodes are not marked for Language of Parts. Issue #1 by Charles Belov describes the problem. Issue #2 by Charles Belov corrected the wording of step 17. No patches or PRs have been submitted.,Stalled (no recent activity),#1 charles belov: Created issue. #2 charles belov: Corrected step 17 wording. #3 mgifford: Appreciated tracking and added WCAG312 tag.,- [WCAG 2.2 Level AA](https://www.w3.org/TR/WCAG22): Accessibility guidelines. - [ARIA Specifications](https://www.w3.org/TR/wai-aria): Accessible Rich Internet Applications.
3361375,Untranslated field labels on translations of nodes are not marked for Language of Parts,Untranslated field labels on translations of nodes are not marked for Language of Parts,https://www.drupal.org/project/drupal/issues/3361375,drupal,Active,Normal,language system,11.x-dev,2 years 7 months,3.1.2,3.1.2,"Users attempting to interact with translated nodes may experience difficulty understanding the purpose of form fields due to the lack of explicitly marked ‘Language of Parts’ information. This can lead to confusion and potential errors when completing forms, hindering accessibility for users who rely on precise label descriptions for guidance.","The issue describes a failure to correctly implement the ‘Language of Parts’ (LoP) attribute for translated form field labels. This is a critical element of WCAG 2.2 guidelines. The core solution involves ensuring that translated field labels accurately reflect the meaning of the original, untranslated labels.","The issue reports untranslated field labels in translated nodes not being marked for Language of Parts, potentially violating WCAG 2.2.1.1 Level AA. No patches or further discussion have been recorded, and the issue remains unresolved.",Charles Belov reported that field labels within translated nodes are not marked for Language of Parts. Minimal discussion has occurred around this issue.,Minimal engagement,#1 charles belov: Issue summary:View changes #2 charles belov: Issue summary:View changes #3 charles belov: Issue summary:View changes,- [WCAG 2.2.1 Level AA](https://www.w3.org/TR/WCAG22/) : Success Criteria for Language Support
2805197,Provide screen-reader feedback when Views UI filterable options are updated,Provide screen-reader feedback when Views UI filterable options are updated,https://www.drupal.org/project/drupal/issues/2805197,drupal,Needs work,Normal,views_ui.module,11.x-dev,9 years 3 months,General,General,"Users relying on screen readers may miss updates to Views UI filterable options due to a lack of auditory feedback. This creates a barrier to understanding the current filter state and selecting appropriate options, potentially leading to inaccurate data analysis or missed opportunities.","To address this, implement a mechanism to announce changes to filterable options to screen reader users. Prioritize semantic HTML solutions first.  Specifically, use a `<details>` element with a `<summary>` element to group the filter options. When the filter options change, the `<summary>` element should announce the updated options via ARIA live regions.",The issue of updating Views UI filterable options not being properly announced to screen readers is currently stalled with no recent activity. The reviewer suggests a manual audit of the code is needed to confirm the fix.,"The issue of updating Views UI filterable options not being properly announced to screen readers was initially reported (#1). A patch was submitted (#2) and subsequently failed to resolve the accessibility barrier, with no further testing or updates since. This issue relates to WCAG 2.2.2 Level A - Keyboard Accessible Area Announcements.",Stalled (no recent activity),#1 dww: Initial report filed regarding missing ARIA announcements for Views UI filterable options. #2 mgifford: Reviewed code and identified a potential issue with the `textContent` property and suggested a fix. #3 dww: Tested the proposed fix but it failed to resolve the accessibility barrier.,- [ARIA Authoring Practices](https://www.w3.org/WAI/ARIA/apg/): Guidelines for creating accessible ARIA attributes. - [WCAG 2.2.2 Keyboard Accessible Area Announcements](https://www.w3.org/TR/WCAG22-CR#keyboard-accessible-area-announcements):  The relevant WCAG success criterion.
2034915,[meta] Track progress in WCAG 2.0 conformance,[meta] Track progress in WCAG 2.0 conformance,https://www.drupal.org/project/drupal/issues/2034915,drupal,Active,Normal,other,11.x-dev,12 years 5 months,General,General,"The issue description lacks detail regarding a specific accessibility barrier. It simply states a need to track WCAG 2.0 conformance. Without further information about the application or website, it’s impossible to determine if an accessibility barrier exists or what steps need to be taken.  The current description doesn't represent a tangible issue.","This issue requires clarification.  Currently, it’s a request for tracking conformance, not a problem.  If the task is to monitor WCAG 2.0 compliance, developers should implement a process for regularly assessing the application against the success criteria. This process should include automated testing (e.g., using Axe, WAVE, or Lighthouse), manual testing with assistive technologies (screen readers, keyboard navigation), and user testing with individuals with disabilities.  Specifically, a detailed audit should be performed to identify areas of non-compliance and prioritize remediation.  Consider using a WCAG conformance checker as part of your development workflow.",,,,,
3230231,image field alt help/description should distinguish between decorative & meaningful images,image field alt help/description should distinguish between decorative & meaningful images,https://www.drupal.org/project/drupal/issues/3230231,drupal,Active,Normal,image system,11.x-dev,4 years 3 months,1.1.1,1.1.1,"Users relying on screen readers may experience confusion when presented with images lacking appropriate alternative text descriptions. Decorative images, which contribute to the visual aesthetic but do not convey essential information, should be marked as such to prevent screen readers from announcing them unnecessarily, thereby disrupting the user experience.",The issue highlights the need for clear distinction between meaningful and decorative images within the image field. The following steps should be taken:,"The issue reports a lack of clear differentiation between decorative and meaningful images in Drupal's image field alt text help, with a proposed solution offered. The issue remains unresolved with no patches or further discussion. The next step is to review and test the proposed solution.","The issue describes a barrier where image field alt text help doesn't distinguish between decorative and meaningful images, potentially violating WCAG 1.1.1 (Non-text Content). RMattB proposed adding “two brackets” to the alt text help for decorative images, a solution currently awaiting review and testing.",Minimal engagement,#1 by RMattB: Created issue and described the problem. #4 by alejandraaviles: Added context regarding existing issues and WCAG guidelines. #6 by mgifford: Tagged the issue with WCAG111. #8 by RMattB: Summarized issue changes. #9 by RMattB: Proposed solution text. #11 by ll66382: Suggested a checkbox option. #12 by mgifford: Suggested a screenshot and a checkbox option. #13 by jan kellermann: Provided two ready solutions.,- [Decorative Image Widget](https://www.drupal.org/project/decorative_image_widget): Proposed solution for distinguishing decorative and meaningful images. - [META: Improve workflows for image alternative](https://www.drupal.org/project/drupal/issues/3081475): Related issue for improving image alternative workflows.
3304479,Improve accessibility of layout preview icons,Improve accessibility of layout preview icons,https://www.drupal.org/project/drupal/issues/3304479,drupal,Active,Normal,other,11.x-dev,3 years 4 months,1.1.1,1.1.1,Users with disabilities who rely on visual cues or screen reader magnification may find it difficult to accurately interpret the function and purpose of layout preview icons. This lack of clear visual information can hinder their ability to understand and utilize the layout preview feature effectively.,This issue highlights a potential barrier to usability for users who rely on visual cues. The primary solution is to improve the design of the layout preview icons to ensure they are clearly distinguishable and understandable.,"The issue report concerns the accessibility of layout preview icons, specifically regarding the clarity of their text descriptions. Minimal discussion has occurred, and no action has been taken. The next step is unclear.","Two users have reported the issue, raising concerns about the accessibility of layout preview icons, particularly the phrasing used for the ""two column"" icon. Chi questioned the relevance of ""Clickable"" and suggested ""graphic"" should be assumed. Mgifford highlighted the challenge of multilingual content and the need for language switching.",Minimal engagement,#1 by Chi: Created issue and described the problem. #2 by mgifford: Offered suggestions for improved phrasing and raised the multilingual content concern. #5 by mgifford: Referenced WCAG 2.2 Level AA and the complexities of multilingual support.,- [WCAG 2.2 Level AA](https://www.w3.org/TR/WCAG22): Accessibility guidelines - [ARIA specifications](https://www.w3.org/TR/wai-aria): Accessible Rich Internet Applications
3087535,"In WYSIWYG embed modal for existing images, the alt text field should have a default value instead of placeholder text","In WYSIWYG embed modal for existing images, the alt text field should have a default value instead of placeholder text",https://www.drupal.org/project/drupal/issues/3087535,drupal,Needs work,Major,media system,11.x-dev,6 years 2 months,1.1.1,1.1.1,"Users relying on screen readers may experience difficulty understanding the purpose of the alt text field within the WYSIWYG embed modal for existing images. The current placeholder text does not provide sufficient context, hindering users' ability to accurately provide or understand the alt text, potentially leading to inaccurate descriptions and a reduced understanding of the image's role in the content.","The issue describes a usability problem with the initial state of the alt text field in the WYSIWYG embed modal.  Instead of a placeholder, the field should default to a clear, actionable value.","The issue involves a default text field in the image library embed modal not having a default value, potentially confusing users. The community is actively collaborating on a solution with a recent patch submitted against Drupal 10.1.","The issue report indicates a need for a default value in the image library embed modal's alt text field. A patch (3087535-27-9.5.x.patch) was submitted against Drupal 9.5.x and 10.1.x, but the tests in 10.1.x seem to have been removed.",Active collaboration,"#1 casey: Initial report only. #2 benjifisher: Discussed the issue with casey, suggested alternative approach. #3 mgifford: Tied the issue to WCAG 1.1.1. #4 charles belov: Suggested displaying the existing media library default alt text outside the field. #27 timohuisman: Rolled back #14 against 9.5.x and 10.1.x.",- [WCAG 2.2 Level AA](https://www.w3.org/TR/WCAG22/): Accessibility guidelines. - [ARIA specifications](https://w3.org/TR/wai-aria/): Accessible Rich Internet Applications.
3272325,Password suggestions are hidden from screenreaders,Password suggestions are hidden from screenreaders,https://www.drupal.org/project/drupal/issues/3272325,drupal,Needs work,Normal,user system,11.x-dev,3 years 8 months,1.1.1,1.1.1,Users who rely on screen readers may be unable to access password suggestion functionality due to the suggestions being hidden from screen reader interpretation. This creates a barrier to successful password management.,"The issue describes a potential lack of screen reader accessibility for password suggestions. The first step is to verify that the password suggestions are actually rendered with appropriate semantic HTML. Specifically, investigate whether the suggestions are contained within a `<button>` or `<input>` element with appropriate labels and ARIA attributes if native semantics are insufficient.","The password strength indicator is not announcing its state to screen readers, creating a barrier to users. The team is currently investigating a live region approach and considering simplification of the solution.",Initial report only. User ‘itmaybejj’ suggests simplifying the solution by toggling an `aria-invalid` attribute on the field instead of relying on a live region. The team is exploring this approach and currently evaluating its feasibility. No evidence of follow-up or resolution.,Initial report only,#1 itmaybejj: Suggested simplification of the solution.,- [ARIA Invalid](https://developer.mozilla.org/en-US/docs/Web/Accessibility/ARIA/Attributes/aria-invalid)
2960415,Media alt text not available in Views,Media alt text not available in Views,https://www.drupal.org/project/drupal/issues/2960415,drupal,Active,Normal,media system,11.x-dev,7 years 8 months,1.1.1,1.1.1,Users relying on screen readers may not receive alternative text descriptions for media content displayed within the Views component. This prevents users from understanding the content of the media and negatively impacts their comprehension and overall experience.,"The issue description indicates a lack of alt text associated with media elements within the Views component. The primary fix involves ensuring that each media element (images, videos, audio) has a properly formatted `alt` attribute that accurately describes the content for screen reader users.","The issue reports a lack of alt text fields for media in Views, preventing accessibility for screen reader users. While a workaround using a custom token has been identified and tested, it hasn’t been adopted and the issue remains unresolved. The next step is for a maintainer to investigate and implement a standard solution.","Users are unable to add alt text to media entities within Views, violating WCAG 1.1.1 Non-text Content. Several contributors have suggested workarounds using custom tokens (#3) or altering the view query with a hook_views_query_alter (#14), but these are not officially supported. The most recent activity is the identification of the token workaround by several users.",Minimal engagement,"#1 johnzzon: Created initial issue. #2 seanb: Suggested relation to media entity. #3 chr.fritsch: Proposed token workaround. #4 piotr pakulski: Confirmed workaround functionality. #5 andrewmacpherson: Identified ""Thumbnail (alt)"" plugin. #10 abhaysaraf: Assigned issue. #11 mrpauldriver: Sought a filter for non-alt text media. #12 johnpitcairn: Confirmed no filter available. #13 happy047: Suggested image alt filter and query alteration. #20 jwilson3: Replicated the issue using a Drupal 10 install. #21 anybody: Expressed disappointment at the lack of alt text support.",- [WCAG 1.1.1 Non-text Content](https://www.w3.org/WAI/WCAG21/Understanding/non-text-content.html): Describes the accessibility requirement. - [Drupal Media Entity API](https://www.drupal.org/docs/core-modules/media/media-entity-api): Provides technical details on the media entity structure.
2770835,Add support for tables with two headers in views table display,Add support for tables with two headers in views table display,https://www.drupal.org/project/drupal/issues/2770835,drupal,Needs work,Normal,views.module,11.x-dev,9 years 5 months,1.1.1,1.1.1,"Users relying on screen readers may experience confusion and difficulty interpreting tabular data when tables display two header rows. This could lead to a reduced understanding of the table’s structure and content, impacting data comprehension.","This issue suggests a potential problem with how tabular data is being rendered within the ""views table display"" component. The core accessibility concern is ensuring screen reader users can correctly identify and understand the header row(s) of the table.","The table display in views can render incorrectly with two headers, leading to a potential accessibility issue for users relying on screen readers. The latest patch (comment #137) addresses this issue, passing tests and indicating a resolution.","The issue stemmed from views' handling of tables with multiple headers, specifically when using the table display style. This resulted in screen readers misinterpreting the table structure, potentially causing confusion and navigation difficulties. The latest patch (comment #137) implemented a fix to ensure proper header identification and table rendering, verified by passing tests.",Active collaboration,#1 themusician: Reported the initial issue and outlined the problem. #2 themusician: Provided detailed reproduction steps and suggested a potential solution (comment #137). #3 themusician: Verified successful test results and confirmed the resolution. #4 themusician: Summarized the final state and provided a link to the updated code.,- [WCAG 2.2.2 Keyboard Accessible Area Relationships](https://www.w3.org/WAI/WCAG21/Understanding/success-criteria-1.4.1): Relevant WCAG success criteria. - [MDN Web Docs - Accessible HTML Tables](https://developer.mozilla.org/en-US/docs/Web/HTML/Table):  Information on accessible table implementation.
3444209,[Regression] Password recommendations are not being announced to screenreader users,[Regression] Password recommendations are not being announced to screenreader users,https://www.drupal.org/project/drupal/issues/3444209,drupal,Active,Normal,user system,11.x-dev,1 year 7 months,1.1.1,1.1.1,"Screenreader users are unable to receive audible guidance regarding password recommendations, potentially hindering their ability to create secure passwords and increasing their risk of compromise. This represents a barrier to effective user experience and accessibility.","This issue likely stems from a lack of appropriate announcement functionality when password recommendations are generated. The first step is to ensure that the element triggering the recommendation (e.g., a `<button>` or `<input>`) has sufficient semantic meaning. If a visual indication of a recommendation is present, consider using a `<summary>` element paired with a `<details>` element to reveal the suggestion when focused.  If a native announcement is not possible, use `aria-describedby` to link the recommendation element to a hidden element containing the text. Implement ARIA attributes to announce the recommendation state, such as `aria-live=""polite""` on an element that updates with recommendations.  Avoid using `role=""alert""` as it’s primarily for errors. Ensure the recommended password is announced clearly and concisely. Prioritize semantic HTML and minimize the use of ARIA.  Reference WAI-ARIA 1.2 for best practices regarding ARIA roles and properties.  Consider using a framework or library that provides accessible announcement functionality if the core requirement is not achievable through native HTML.",Initial report only regarding password recommendations not being announced to screenreader users. Minimal discussion and no patches or resolutions have been identified. The issue remains unaddressed.,Initial report only stating that password recommendations are not being announced to screenreader users. No further details or attempts to reproduce or resolve the issue are present.,Initial report only,#1 rkoller: Created issue.,- [WCAG 2.2.1 Perceivable](https://www.w3.org/WAI/WCAG22/Understanding/perceivable): Related to screen reader compatibility.
2986117,Find a way to differentiate different media types in the administrative media library grid view,Find a way to differentiate different media types in the administrative media library grid view,https://www.drupal.org/project/drupal/issues/2986117,drupal,Active,Normal,media system,11.x-dev,7 years 5 months,1.1.1,1.1.1,Users with disabilities relying on screen readers may have difficulty distinguishing between different media types within the administrative media library grid view. This lack of differentiation impedes their ability to quickly and effectively locate specific media assets based on their format.,The issue describes a need to visually and programmatically differentiate media types within a grid view. The primary focus should be on leveraging semantic HTML to achieve this.,"The administrative media library grid view lacks distinct visual differentiation between media types, causing potential WCAG 1.1.1 issues. The issue is currently flagged for review and awaiting a patch or further investigation.","Nine unique users have reported a need to differentiate media types in the administrative media library grid view. Geek-merlin suggested using a film roll overlay similar to Ubuntu Nautilis, while ckaotik proposed a styling solution. Phenaproxima has flagged the issue for accessibility review and usability review, and Andrewmacpherson highlighted the importance of non-visual conveyance of information. No patches or merge requests have been submitted.",Minimal engagement,"#1 phenaproxima: Created the initial issue. #2 geek-merlin: Clarified the UI suggestion. #3 geek-merlin: Provided UI example. #4 ckaotik: Suggested a styling approach. #10 phenaproxima: Flagged for accessibility review. #11 phenaproxima: Added usability and accessibility tags. #12 andrewmacpherson: Clarified media library widget context. #13 bkosborne: Re-emphasized the usability need. #14 phenaproxima: Re-iterated the issue summary. #15 ckaotik: Submitted a preliminary styling solution. #21 smustgrave: Questioned about the tabs on the side. #22 feyp: Referenced the comment regarding the grid view. #24 mgifford: Identified potential WCAG 1.1.1 violation. #25 chris matthews: Requested the status to be ""Active"".","- [WCAG 1.1.1 Non-text Content](https://www.w3.org/WAI/WCAG21/Understanding/non-text-content): Guidance on conveying information without relying solely on text. - [ARIA Specifications](https://www.w3.org/TR/wai-aria/): Relevant ARIA roles and attributes could be utilized for enhancing accessibility, although no specific mention is in the thread."
2780293,Add GUI to configure the site's logo alt attribute,Add GUI to configure the site's logo alt attribute,https://www.drupal.org/project/drupal/issues/2780293,drupal,Needs work,Normal,theme system,11.x-dev,9 years 4 months,1.1.1,1.1.1,"Users relying on screen readers may be unable to easily update the alternative text description for the site’s logo. Without a configurable GUI, staff responsible for website updates must manually edit the HTML, which is a time-consuming and error-prone process. This directly impacts the ability to provide meaningful context for users who rely on visual cues, potentially hindering comprehension and navigation.","The issue describes a need for a mechanism to manage the `alt` attribute of the site’s logo. Currently, this must be done directly within the HTML source code. To address this, implement a simple configuration panel within the website’s admin interface. This panel should allow users to type in and save a custom `alt` text string for the `<img>` tag.","The site’s logo lacks sufficient color contrast, potentially impacting accessibility for users with low vision, according to WCAG 1.1.1. The issue is currently stalled with no recent activity and requires further testing.","Initial report only. The issue stems from a reported lack of sufficient color contrast in the site’s logo. Multiple contributors have acknowledged the problem, but no concrete testing or remediation has occurred since the initial report. No evidence of follow-up or resolution.",Initial report only,#1 reporter: Filed initial accessibility report regarding logo color contrast.,- [WCAG 1.1.1 Non-text Contrast](https://www.w3.org/WAI/WCAG21/Understanding/contrast):  Guidance on color contrast requirements.
