Issue ID,Issue Title,Description,Issue URL,Project,Status,Priority,Component,Version,Created,wcag_sc,ai_wcag,acr_note,dev_note,thread_tldr,thread_problem,thread_sentiment,thread_timeline,thread_links
3269420,Toolbar icons may not meet contrast when in forced colors mode,Toolbar icons may not meet contrast when in forced colors mode,https://www.drupal.org/project/drupal/issues/3269420,drupal,Active,Normal,toolbar.module,11.x-dev,3 years 9 months,1.4.11,1.4.11,"Users employing forced color modes may experience reduced visual contrast between toolbar icons and their background, potentially impacting their ability to perceive and interact with these elements. This violates WCAG 2.2 guidelines for color contrast.",,"The issue of toolbar icons not meeting contrast requirements in forced colors mode remains unresolved. A suggestion has been made to improve semantics, but no patches or resolutions have been implemented and the issue is stalled due to conflicting themes and overrides.","The original report identified a contrast issue with toolbar icons in forced colors mode. Initial discussion (mherchel, mgifford, kentr, libbna) centered on Claro overrides and the potential need to remove them, or alternatively, implementing a role=""button"" attribute in the Toolbar module. Kentr identified that Claro overrides the toolbar styles even when it’s not the default theme and that Gin may also inherit Claro code.  A suggestion to improve semantics has been raised, but no action has been taken on this. No WCAG Success Criteria are explicitly referenced in the discussion.",Stalled (no recent activity),#1 mherchel: Created initial issue report. #5 mgifford: Tagged WCAG 1.1.1. #6 kentr: Suggested removing Claro overrides. #7 kentr: Identified the need to address pressed and active link states. #8 libbna: Raised a question about alternative images if overrides are removed. #9 kentr: Re-emphasized removing Claro overrides. #10 libbna: Asked for clarification on the resolution process given the Claro replacement. #11 kentr: Clarified that the toolbar styles are still provided by Claro. #12 kentr: Discovered Gin inherits Claro code and that the change may not resolve the issue in Gin. #13 kentr: Identified that Claro overrides even when it's not the default theme #14 kentr: Added suggestion #3090120.,- [WCAG 1.1.1 Non-text Contrast](https://www.w3.org/WAI/WCAG21/Understanding/non-text-contrast): Defines the contrast ratio requirement. - [ARIA Specifications](https://w3.org/TR/wai-aria/): Provides guidelines for accessible web applications.
3506333,Improve the perceptibility of contextual link buttons,Improve the perceptibility of contextual link buttons,https://www.drupal.org/project/drupal/issues/3506333,drupal,Active,Normal,media system,11.x-dev,10 months 1 week,1.4.11,1.4.11,Users with low vision may have difficulty identifying and operating contextual link buttons due to insufficient contrast or inadequate size. This impacts their ability to navigate and interact with the content effectively.,"The issue description – “Improve the perceptibility of contextual link buttons” – is vague. We need to understand *how* the buttons are currently presented and what “perceptibility” means in this context. Assuming the buttons are implemented as standard `<button>` elements or `<a>` tags styled to *look* like buttons, the following steps should be taken:","The issue is related to the perceptibility of contextual link buttons in Drupal themes. Minimal discussion has occurred, and no patches or resolutions have been identified. The next step is awaiting further investigation and potential fixes.","The issue, reported by rkoller, concerns the low contrast of contextual link buttons within Drupal themes. mgifford identified the problem impacting both Gin and Claro themes and suggested minimizing SVG usage and utilizing the ButtonFace. The discussion centers on the Ajax system and media system components, but does not indicate a specific solution or test results.",Minimal engagement,"#1 rkoller: Created issue and described the problem. #2 mgifford: Provided context regarding the issue's impact on multiple themes and suggested a CSS-based solution. #3 mgifford: Expanded on the component scope (ajax system, media system). #4 quietone: Repeated information about version and core change policies.",- [WCAG 2.2 Success Criterion 1.4.1 - Contrast (Minimum):](https://www.w3.org/WAI/WCAG21/criteria/contrast) - [ARIA Specifications](https://www.w3.org/TR/wai-aria/): Regarding accessible controls.
3272592,"CKEditor 5 has its own focus styles, should use the admin theme's (e.g. Claro's)","CKEditor 5 has its own focus styles, should use the admin theme's (e.g. Claro's)",https://www.drupal.org/project/drupal/issues/3272592,drupal,Needs work,Normal,ckeditor5.module,11.x-dev,3 years 8 months,1.4.11,1.4.11,"Users with screen reader or other assistive technology may experience difficulty determining the focus state of the CKEditor 5 editor when using a theme other than the default. The editor’s own focus styles differ from those of the admin theme, potentially leading to a disjointed and confusing user experience for keyboard and switch users.","The core issue is the CKEditor 5 editor applying its own focus styles, which clash with the intended focus styles of admin themes like Claro. To resolve this, the developers should:","CKEditor 5's focus styling is inconsistent across admin themes, specifically lacking a hover effect that mitigates a visual distraction. The issue is currently awaiting review and a potential solution involving theme customization.",Gin Admin theme successfully resolves the visual distraction caused by the lack of a hover effect on toolbar grouping items by applying a `box-shadow` when focused. No recent activity has been observed regarding this issue within the issue tracker. No evidence of follow-up or resolution.,Minimal engagement,#1 pere orga: Reported the accessibility issue. #2 smustgrave: Requested an update. #3 pere orga: Updated issue summary.,- [WCAG 2.2 Level AA](https://www.w3.org/WAI/WCAG22/): Accessibility guidelines. - [ARIA specifications](https://w3.org/TR/wai-aria/): For accessible user interfaces.
1899236,Add new Splitbutton render element to eventually replace Dropbutton,Add new Splitbutton render element to eventually replace Dropbutton,https://www.drupal.org/project/drupal/issues/1899236,drupal,Needs work,Normal,theme system,11.x-dev,12 years 11 months,1.4.11,1.4.11,"The issue description lacks specific details regarding accessibility. The proposed change to replace a Dropbutton with a Splitbutton raises a potential barrier if the new element is not implemented with sufficient accessibility in mind. Without knowing how the Splitbutton is rendered and its associated functionality, it’s impossible to determine if users with disabilities will be able to effectively interact with it.","This issue presents a potential accessibility risk if the Splitbutton render element isn’t designed and implemented correctly. The initial focus should be on ensuring a fundamentally accessible implementation utilizing semantic HTML. Specifically, investigate if a `<button>` element with appropriate `role=""menu""` and `aria-haspopup=""true""` attributes can effectively simulate the Splitbutton's functionality.  Consider using a `<menu>` element within the button to hold the dropdown items, ensuring each menu item has an accessible `role=""menuitem""` and `aria-label` attribute.","The Splitbutton render element has been introduced to replace Dropbutton, aiming for improved accessibility. The code is currently in a ""Needs work"" state, with Kostyashupenko having made an initial commit, but the changes haven't been fully vetted and are currently failing tests. The next step is a thorough review and potential rework of the code.","Kostyashupenko has created an initial merge request introducing the new Splitbutton render element.  The core change involves replacing Dropbutton with Splitbutton, aiming to align with accessibility best practices. However, this initial commit has triggered some failures, indicating potential issues with the implementation or the broader impact of the change. No further user or reviewer activity has been observed beyond Kostyashupenko's initial contribution.",Minimal engagement,#193 kostyashupenko: Made initial commit to merge request. #194 kostyashupenko: Rebased.,- [WCAG 2.2 Level AA](https://www.w3.org/TR/WCAG22/): The target accessibility conformance level. - [ARIA Specifications](https://w3.org/TR/wai-aria/): Relevant ARIA guidelines.
2910102,Improve icon color contrast for WCAG 2.1,Improve icon color contrast for WCAG 2.1,https://www.drupal.org/project/drupal/issues/2910102,drupal,Active,Normal,other,11.x-dev,8 years 3 months,1.4.11,1.4.11,"Users with low vision may have difficulty distinguishing icons with insufficient color contrast against their background, potentially hindering their ability to understand and interact with the website's functionality. This violates WCAG 2.1 guidelines regarding color contrast.","To address this issue, focus on improving the color contrast between icons and their background colors. Prioritize solutions using semantic HTML and CSS.","The issue of insufficient icon color contrast for WCAG 2.1 AA was initially reported and flagged, primarily focused on contextual link buttons within the Drupal core.  Andrewmacpherson identified failures against SC 1.4.11 and expanded the review scope to include other themes. No patches or resolutions have been implemented as of the last recorded activity.","The issue concerns a potential violation of WCAG 2.1 Success Criteria 1.4.11 (Non-text Contrast) related to the color contrast of icons within Drupal contextual link buttons. Travisd.peltier raised the initial report, and Andrewmacpherson subsequently expanded the review to include the Bartik and Seven themes, as well as the Umami theme. The current state reflects a review in progress, with no implemented fixes or tested solutions.",Minimal engagement,"#1 travis.d.peltier: Created issue. #2 andrewmacpherson: Acknowledged issue and added tags. #3 andrewmacpherson: Expanded review scope and noted WCAG 2.1. #4 travis.d.peltier: Acknowledged reply. #5 andrewmacpherson: Added Out of the Box Initiative tag and further expanded review to other themes. #6 andrewmacpherson: Clarified merging of Success Criteria in WCAG 2.1. #7 andrewmacpherson: No activity. #8 avpaderno: Referenced Drupal version. #11 mgifford: Added WCAG 1.4.11 tag. #16 mgifford: Added ""atag"" tag. #18 anicoto:  Reiterated the issue title.",- [WCAG 2.1 Success Criterion 1.4.11](https://www.w3.org/TR/WCAG21/): Non-text contrast. - [ARIA Specifications](https://w3.org/TR/wai-aria/): Accessibility API. - [MDN Web Docs - Color Contrast](https://developer.mozilla.org/en-US/docs/Web/Accessibility/Color/Contrast_ratios): Color contrast ratios.
3269342,"""Edit"" cog icon for Field UI does not meet contrast minimums when in forced colors","""Edit"" cog icon for Field UI does not meet contrast minimums when in forced colors",https://www.drupal.org/project/drupal/issues/3269342,drupal,Active,Normal,field_ui.module,11.x-dev,3 years 9 months,1.4.11,1.4.11,"The ""Edit"" cog icon within the Field UI may not be accessible to users with low vision when the application is forced to use a specific color scheme. Insufficient color contrast between the icon and its background can prevent users from perceiving the icon’s meaning and functionality, potentially hindering their ability to complete tasks.",,"The ""Edit"" cog icon for Field UI does not meet contrast minimums when in forced colors, as identified by mherchel. Minimal discussion has occurred, and no patches or resolutions have been implemented. The issue is currently stalled with no recent activity.","Initial report by mherchel identifies a contrast issue with the ""Edit"" cog icon in Field UI when using forced colors. mgifford tagged the issue with WCAG 1.4.1 (Non-text contrast) and referenced Windows High Contrast Mode. No patches or PRs have been submitted.",Minimal engagement,#1 mherchel: Created issue and described the problem. #2 mgifford: Tagged the issue with WCAG 1.4.1 and Windows High Contrast Mode.,- [WCAG 1.4.1: Non-text contrast](https://www.w3.org/WAI/WCAG22/Understanding/non-text-contrast): Explanation of the WCAG success criteria. - [Windows High Contrast Mode](https://support.microsoft.com/en-us/windows/windows-high-contrast-mode-e46c794e-3294-4c4a-894a-d7984130e1c2): Details on the Windows feature referenced.
3037742,The toggle that makes Contextual Links visible at all times might not be sufficiently discoverable,The toggle that makes Contextual Links visible at all times might not be sufficiently discoverable,https://www.drupal.org/project/drupal/issues/3037742,drupal,Active,Major,layout_builder.module,11.x-dev,6 years 9 months,1.4.11,1.4.11,"Users may experience difficulty locating the toggle that controls the persistent visibility of Contextual Links, potentially hindering access to important information. The lack of discoverability presents a barrier to usability for users who rely on assistive technology.",...,"The Contextual Links module’s toggle for always-visible contextual links is considered discoverable by some, but not consistently, particularly within Layout Builder mega menus. The issue is stalled with no recent activity, and the maintainer requires more information.","The issue revolves around the discoverability of the Contextual Links toggle within the Layout Builder module. Several users, including andrewmacpherson, have highlighted that the toggle is not consistently visible, especially when contextual links reside within a mega menu.  A key concern raised by andrewmacpherson is the inability for speech control users to delete blocks due to the lack of visibility of these links. No patches or PRs have been submitted.",Stalled (no recent activity),"#1 by andrewmacpherson: Created issue, described discoverability problem with Contextual Links toggle within Layout Builder. #7 by wim leers: Postponed issue, citing need for maintainer input. #8 by xjm: Re-stated the discoverability issue within Layout Builder. #9 by andrewmacpherson: Emphasized the criticality of the toggle for tasks like block deletion, particularly for speech control users. #13 by bkosborne: Added related issues, including one related to removing contextual links in Layout Builder. #15 by galactus86:  Acknowledged the issue, emphasizing the importance of usability. #18 by maskedjellybean: Suggested matching the Edit section's visibility to the contextual links. #19 by larowlan: Confirmed Layout Builder-specific nature of the problem. #22 by rkoller: Added a comment, requesting visibility of the buttons all the time.",- [WCAG 1.4.11: Moving Keys](https://www.w3.org/WAI/WCAG21/criteria-3.2.1): Related to keyboard navigation and discoverability. - [ARIA Specifications](https://www.w3.org/TR/wai-aria/): Relevant for accessible UI controls and their roles.
2848549,Refine the layout selection UI,Refine the layout selection UI,https://www.drupal.org/project/drupal/issues/2848549,drupal,Active,Major,layout_discovery.module,11.x-dev,8 years 10 months,1.4.11,1.4.11,"The issue description, “Refine the layout selection UI,” is vague and does not identify a specific accessibility barrier. Without further information about the current UI or the intended changes, it’s impossible to determine if an accessibility problem exists. A refined UI could introduce new barriers or exacerbate existing ones.","This issue requires investigation to understand the specifics of the “layout selection UI.”  However, the initial description suggests a potential problem related to how users with disabilities can access and interact with layout options. The first step is to audit the existing UI for conformance with WCAG 2.2 Level AA.  Specifically, consider these points:","The layout selection UI requires refinement to ensure keyboard accessibility. While initial discussion identified the need for keyboard navigation and thumbnail selection, no concrete solutions or patches have been implemented, and the issue remains unresolved. Next step: Maintainer review required.","The layout selection UI lacks keyboard navigation support, presenting a barrier for users who cannot use a mouse. Discussion identified the need to implement “click on an icon” functionality with keyboard alternatives, specifically suggesting using<button>s or styled radio buttons.  Tim.plunkett flagged the issue as a blocker relative to a broader layout distinction initiative (#2822758). No patches or pull requests have been submitted.",Minimal engagement,#1 yoroy: Created initial issue. #2 tim.plunkett: Offered initial feedback on keyboard navigation and the need for a hidden input. #3 yoroy: Suggested drawing inspiration from the media library design. #4 xjm: Provided context linking to related issues and a reference to a retro video game. #7 damienmckenna: Recommended replacing the selector with thumbnails and titles. #9 damienmckenna: Raised concerns about the scale of layout management across themes. #10 pixelite: Provided images and suggestions for integrating feedback. #11 pixelite: Continued to offer images of proposed UI elements. #14 tim.plunkett: Clarified component ownership. #17 andrewmacpherson: Provided component context. #27 mgifford: Highlighted WCAG 2.2 Success Criteria 1.4.1.,- [WCAG 2.2 Success Criteria 1.4.1 - Accessible Colors](https://www.w3.org/WAI/WCAG22/Understanding/contrast):  Addresses color contrast considerations for visual accessibility. - [ARIA Specifications](https://www.w3.org/TR/wai-aria/): Relevant for defining accessible UI controls and behaviors.
3273806,WCAG color constrast fails on toolbar direction icon,WCAG color constrast fails on toolbar direction icon,https://www.drupal.org/project/drupal/issues/3273806,drupal,Active,Normal,toolbar.module,11.x-dev,3 years 8 months,1.4.11,1.4.11,"The toolbar direction icon may not meet WCAG color contrast requirements, potentially creating a barrier for users with low vision who rely on color to distinguish between interactive elements.","To address this issue, the first step is to examine the color values used for the direction icon and the background color of the toolbar.  Utilize a color contrast analyzer tool (e.g., WebAIM Contrast Checker, or browser developer tools) to determine if the contrast ratio meets WCAG 2.2 AA requirements (4.5:1 for normal text, 3:1 for large text).  If the contrast ratio is insufficient, implement a solution prioritizing semantic HTML.  This may involve: 1) Changing the icon’s color to a darker shade with sufficient contrast against the toolbar background. 2) Adding a text label adjacent to the icon for users who have difficulty perceiving color. Avoid using ARIA attributes unless native HTML semantics are completely inadequate.  Ensure the icon's state (hover, focus) also maintains sufficient color contrast.  Document the color choices and contrast ratios used.","The issue reports a color contrast failure on a toolbar direction icon, specifically related to WCAG 2.2 Success Criterion 1.4.1. Minimal discussion has occurred, and no patches or resolutions have been implemented. The issue requires review and testing.","Initial report only. mhowe91 reported a WCAG color contrast failure on the toolbar direction icon. cilefen directed the reporter to the main toolbar accessibility issue (#3084529). dww tagged the issue with the ""Bug Smash Initiative"" and related it to the main toolbar accessibility issue. mgifford referenced WCAG 2.2 Success Criterion 1.4.1.",Minimal engagement,#1 mhowe91: Created issue. #2 cilefen: Directed to related issue #3084529. #3 dww: Tagged issue and related it to #3084529. #7 mgifford: Referenced WCAG 2.2 Success Criterion 1.4.1.,- [WCAG 2.2 Success Criterion 1.4.1](https://www.w3.org/WAI/WCAG22/Understanding/contrast-1411): Color contrast requirements.
2919837,Accessibility Issues with Off-Canvas dialog,Accessibility Issues with Off-Canvas dialog,https://www.drupal.org/project/drupal/issues/2919837,drupal,Active,Normal,settings_tray.module,11.x-dev,8 years 1 month,1.4.12,1.4.12,Users relying on screen readers may experience difficulty accessing content within an off-canvas dialog due to lack of clear focus management and insufficient keyboard navigation. This impacts the user's ability to understand the dialog’s content and interact with its elements.,"The issue title, “Accessibility Issues with Off-Canvas dialog”, is too broad. To address this, we need to investigate whether the off-canvas dialog is properly implemented for keyboard navigation and screen reader interaction. Specifically, the following steps should be taken:","The issue thread concerns inconsistent focus styles for the off-canvas dialog's close button, identified as a potential WCAG 2.1 contrast issue. The issue has been resolved through a duplicate merge, but a follow-up issue to standardize the close button design has been created.","Andrewmacpherson reported inconsistent focus styles for the close button across browsers (solid blue border vs. default browser style), impacting accessibility.  mgifford identified a contrast ratio issue with the close button (#2d2d2d) and linked to WCAG 2.1 Success Criteria for new success criteria from WCAG 2.1. Andrewmacpherson also noted related issues (#2863354) concerning the close button in other dialogs.",Minimal engagement,#1 by mgifford: Created the initial issue. #5 by andrewmacpherson: Reported the focus style inconsistency and contrast issue. #10 by xjm: Merged #2928409 as a duplicate. #11 by xjm: Created a new issue for design standardization.,- [WCAG 2.1 Success Criteria](https://www.w3.org/WAI/WCAG21/): Relevant WCAG success criteria. - [ARIA Specifications](https://w3.org/TR/wai-aria/): Relevant ARIA specifications.
3448100,In the mobile version of navigation the close button is not accessible by the keyboard,In the mobile version of navigation the close button is not accessible by the keyboard,https://www.drupal.org/project/drupal/issues/3448100,drupal,Needs work,Normal,navigation.module,11.x-dev,1 year 7 months,2.1.1,2.1.1,"The mobile navigation close button is not operable using keyboard navigation, preventing keyboard users from closing the navigation menu. This violates WCAG 2.2 accessibility guidelines, impacting usability for keyboard-only users.",,"The mobile navigation close button accessibility issue has been resolved. Gauravvvv submitted a patch that makes the button accessible via the keyboard and Esc key, and ahsannazir verified the fix. Further testing is recommended.","The original report identified a lack of keyboard accessibility for the mobile navigation close button. Gauravvvv implemented a patch (PR not yet created - see comment #2) to address this. ahsannazir verified the fix, confirming that the button is now accessible via the keyboard and the Esc key closes the menu.",Active collaboration,"#1 rkoller: Created the original issue. #2 Gauravvvv: Made a first commit to the fork, indicating a potential fix. #8 ahsannazir: Made a first commit to the fork and verified the fix. #7 quietone: Updated the version to 11.0.x-dev.",- [ARIA Specifications](https://www.w3.org/TR/wai-aria/): Relevant for keyboard accessibility considerations. - [WCAG 2.2 Keyboard Accessibility](https://www.w3.org/WAI/WCAG22/Understanding/Keyboard-Accessibility):  Relevant WCAG Success Criteria.
3541741,Close only lowest-level submenu with Escape key,Close only lowest-level submenu with Escape key,https://www.drupal.org/project/drupal/issues/3541741,drupal,Active,Normal,navigation.module,11.x-dev,4 months 6 days,2.1.1,2.1.1,"Users relying on keyboard navigation may be unable to close lower-level submenus using the Escape key, potentially trapping them within the submenu and preventing access to the parent menu. This impacts users with motor impairments who rely on keyboard interaction for navigation.","This issue addresses the requirement to provide a clear and predictable way to close lower-level submenus using the Escape key.  The preferred approach is to utilize the `aria-haspopup=""true""` attribute on the parent menu element, coupled with the appropriate `aria-expanded` state change when the submenu is opened and closed. This triggers native behavior and avoids reliance on custom JavaScript. If native behavior is truly not achievable, implement the following:","The issue report describes a situation where the Escape key closes submenus, but the issue is only reported by one user and hasn't led to any action or a proposed solution. No patches or further discussion have occurred.",Kentr reported that the Escape key closes multiple submenu levels instead of only the lowest-level submenu. Initial report only.,Initial report only,#1 kentr: Title: Escape key closes multiple submenu levels» Close only lowest-level submenu with Escape key,- [WCAG 2.2.2 Keyboard – Requires Complete Keyboard Navigation](https://www.w3.org/WAI/WCAG22/Understanding/keyboard-navigation.html)
