Issue ID,Issue Title,Description,Issue URL,Project,Status,Priority,Component,Version,Created,wcag_sc,ai_wcag,acr_note,dev_note,thread_tldr,thread_problem,thread_sentiment,thread_timeline,thread_links
2973124,Provide better context in accessible names of EntityOperation views plugin drop-button operations,Provide better context in accessible names of EntityOperation views plugin drop-button operations,https://www.drupal.org/project/drupal/issues/2973124,drupal,Needs work,Normal,views.module,11.x-dev,7 years 7 months,2.5.3,2.5.3,Users relying on screen readers may experience difficulty understanding the purpose of actions presented within the EntityOperation views plugin drop-button operations due to ambiguous or lacking accessible names. This creates a barrier to independent operation of the website.,The issue highlights a problem with the accessibility of the drop-button operations within the EntityOperation views plugin. The current accessible names are likely too generic.  The primary solution should be to use semantic HTML elements to clearly identify the actions.,"The issue relates to accessible naming of drop-down operation buttons within the EntityOperation views plugin. Initial report noted inaccessible names, and a patch has been submitted for review. Further investigation and testing are needed to confirm the fix.","The issue describes a WCAG 2.2.2 (Level AA) accessibility concern regarding the names of buttons within the EntityOperation views plugin's drop-down operations. A patch (2973124_48) was submitted that attempts to address this by using more descriptive labels. However, the patch is currently unreviewed, and the issue remains unresolved.",Minimal engagement,#1 vsujeetkumar: Submitted patch 2973124_48. #2 vsujeetkumar: Added interdiff 43-45. #3 vsujeetkumar: Added interdiff 45-48. #4 vsujeetkumar: Added interdiff 48-48 #5 vsujeetkumar: Added interdiff 48-48,- [WCAG 2.2.2 (Level AA)](https://www.w3.org/TR/WCAG22/): Level AA accessibility criteria. - [ARIA Specifications](https://www.w3.org/TR/wai-aria/): ARIA best practices for accessibility.
3026317,a11y revision for Claro,a11y revision for Claro,https://www.drupal.org/project/drupal/issues/3026317,drupal,Active,Normal,Claro theme,11.x-dev,6 years 11 months,2.5.5,2.5.5,"The issue description lacks specific details, making it impossible to determine the accessibility barrier. It’s currently unclear if the “Claro” element presents a problem for users with disabilities. Further investigation is required to understand the intended functionality and identify potential accessibility issues.","To address this issue, we need more information about “Claro”.  However, assuming “Claro” represents a specific UI component or interactive element, the initial approach *must* be to examine its semantic HTML structure.  Specifically, we need to verify if the element’s roles, states, and properties are correctly conveyed through HTML5 elements (e.g., `<button>`, `<input>`, `<select>`). If a native HTML element doesn’t adequately represent the functionality, we can then consider using ARIA attributes to enhance accessibility.","The issue concerns insufficient color contrast between the focus and hover states of buttons in the Claro theme, potentially impacting users with low vision. The discussion is active, with multiple contributors suggesting solutions, but no concrete fixes or changes have been implemented yet. The next step is waiting for a design review and implementation of a more accessible outline color.","Several contributors, including modulist and AndrewMacpherson, identified insufficient color contrast between the button focus and hover states and the primary button color. Modulist specifically proposed using a lime green (#7cbc48) outline for improved visibility. AndrewMacpherson acknowledged the concern, but stated they don't plan to fully address the focus style due to WCAG Target Size considerations and the difficulty of matching the Bluecheese theme. SASCHAeggi acknowledged the feedback, suggesting a wait and review.",Active collaboration,#1 by ckrina: Created original issue. #2 by andrewmacpherson: Confirmed discussion on Slack and requested appropriate tags. #3 by andrewmacpherson: Suggested using the “a11y” tag. #4 by andrewmacpherson: Added detail about complex components and requested notes on addressing accessibility. #5 by modulist: Suggested WCAG 2.1 AAA target size and color palette recommendations. #6 by modulist:  Highlighted the importance of the outline color contrast. #7 by saschaeggi: Acknowledged the feedback. #8 by andrewmacpherson: Clarified the WCAG Target Size success criterion and the icon size discussion. #9 by andrewmacpherson: Provided the specific lime green hex code and explained the theme incompatibility. #10 by ckrina: Linked to a separate issue proposal for button sizes. #11 by ckrina: Added details about icons and WCAG info requirements. #12 by modulist: Offered advice on using frames in Figma for transparent icons. #13 by huzooka: Added context around the Claro theme and Drupal version. #19 by finnsky: Linked to related Drupal issue #3293469,- [WCAG 2.1 Success Criterion 1.4.3 (Contrast Ratio)](https://www.w3.org/TR/WCAG21/):  Clarifies the contrast ratio requirements. - [MDN Web Docs - Accessibility](https://developer.mozilla.org/en-US/docs/Web/Accessibility):  General accessibility resources. - [Drupal Theme Design Guidelines](https://www.drupal.org/docs/8.9/system-themes/theme-design): Provides guidance on Drupal theme design.
3506334,Increase the target sizes to meet the minimum requirement,Increase the target sizes to meet the minimum requirement,https://www.drupal.org/project/drupal/issues/3506334,drupal,Active,Normal,ajax system,11.x-dev,10 months 1 week,2.5.8,2.5.8,Users with low vision may experience difficulty interacting with interactive elements (targets) due to their small size. This potentially violates WCAG 2.1.A.13 Contrast (Minimum) and 2.2.A.11 Low Contrast Ratios.,"The reported issue suggests a need to adjust the size of visual targets. The first step is to evaluate the existing design to determine if the target sizes meet WCAG 2.2 Level AA success criteria regarding contrast and size.  Specifically, consider 1.1.1 (Non-text Content) and 2.2.A.11 (Low Contrast Ratios).","The issue of increasing target sizes to meet WCAG 2.2 Level AA requirements was initially reported and discussed, but no patches or resolutions have been implemented. The issue has been moved to Drupal Core but remains unresolved, with ongoing discussion regarding appropriate target sizes and related strategies.",rkoller reported the need to increase target sizes to meet WCAG 2.2 Level AA requirements. mgifford moved the issue to Drupal Core and provided links to resources on target size testing and guidelines from organizations like Smashing Magazine and Tetralogical.  The discussion centers around defining an “ideal minimum size” and utilizing the Target Size (Minimum) criterion. No patches or technical fixes have been proposed or implemented.,Minimal engagement,#1 rkoller: Created issue and reported the need to increase target sizes. #2 mgifford: Moved the issue to Drupal Core and provided external resources. #3 mgifford: Provided additional resources and clarification on target size considerations. #4 rkoller: Requested moving the issue back to the Gin theme. #5 mgifford: Offered a link to a Target Size Highlighter tool. #6 mgifford: Related issue #3491461 mentioned. #7 mgifford: Provided a resource on foundations target size. #8 quietone:  Reiterated the core issue tracking process.,- [Target Size and 2.5-5](https://adrianroselli.com/2019/06/target-size-and-2-5-5.html):  Details on target size testing. - [How to Test 2.5-8 Target Size Minimum](https://www.tpgi.com/how-to-test-2-5-8-target-size-minimum/): Testing methodology. - [Understanding SC 2.5-8 Target Size Minimum](https://www.digitala11y.com/understanding-sc-2-5-8-target-size-minimum/):  Explanation of the SC. - [Ac Digital – Accessible Component Size](https://www.smashingmagazine.com/2023/04/ac-digital-accessible-component-size/):  Guidance on component sizing. - [Accessibility-Tools Target Size Highlighter](https://accessibility-tools.github.io/target-size-highlighter/): Tool for assessing target sizes.
3491461,[meta] Some interface components don’t meet the minimum target size,[meta] Some interface components don’t meet the minimum target size,https://www.drupal.org/project/drupal/issues/3491461,drupal,Active,Normal,Claro theme,11.x-dev,1 year 2 weeks,2.5.8,2.5.8,"Users with low vision may experience difficulty perceiving interface components that do not meet minimum target sizes, potentially impacting their ability to interact with the website effectively. The issue statement lacks specifics regarding the components and target size, necessitating further investigation to determine the extent of the accessibility barrier.","To address this issue, developers should investigate which interface components are failing to meet minimum target sizes. The initial focus should be on adjusting the CSS to ensure that all components are sufficiently large, prioritizing semantic HTML elements for layout and structure.  Specifically, examine the use of `min-width` and `max-width` in CSS. If semantic HTML elements are insufficient to create a large enough component, then use ARIA attributes judiciously to provide the necessary accessibility information. For example, if a visually hidden element is required to provide context to a smaller component, utilize `aria-describedby` to link the elements. Ensure appropriate color contrast ratios are maintained, as this can impact visibility.  Consider using relative units (em, rem, %, vw, vh) for sizing to allow for responsive design.  Validate the HTML and CSS using a validator (e.g., W3C Markup Validation Service) to identify and correct any structural issues.","The issue of interface components not meeting minimum target size is being addressed, with a focus on the breadcrumb. The issue is under review, awaiting explicit enablement of WCAG 2.2 AA tests.","rkoller reported that interface components don’t meet the minimum target size, referencing WCAG 2.5.8.  mgifford acknowledged the issue and added a reference to WCAG 2.2, highlighting the upcoming requirement. No patches or PRs have been submitted.",Minimal engagement,#1 rkoller: Created issue and added initial description. #2 rkoller: Added WCAG 2.2 reference. #3 mgifford: Provided acknowledgement and WCAG 2.2 reference. #4 rkoller: Added breadcrumb to examples.,- [WCAG 2.5.8 - Color Contrast](https://www.w3.org/WAI/WCAG22/Understanding/contrast): Information on color contrast requirements. - [WCAG 2.2 - Target Size](https://www.w3.org/WAI/WCAG22/Understanding/target-size-minimum): Official WCAG 2.2 documentation on minimum target size.
2827034,DateList and date range inline form errors are repeated,DateList and date range inline form errors are repeated,https://www.drupal.org/project/drupal/issues/2827034,drupal,Needs work,Normal,datetime.module,11.x-dev,9 years 1 month,3.1.2,3.1.2,Users attempting to select dates within the DateList and date range inline forms may experience confusion and frustration due to repeated error messages. This could impede accurate date input and negatively impact the user experience.,The reported issue describes a likely scenario where the inline form is displaying repeated error messages for invalid date selections. This suggests a design flaw where the form doesn't adequately handle invalid date inputs and provides excessive feedback.,"The inline date range widget is displaying an incorrect error message when either the start or end date is empty, leading to a confusing user experience. The issue is currently stalled with no recent activity.","The issue involves the inline date range widget failing to correctly display an error message when either the start or end date is empty. Patch #2827034 attempted to address this, but the reported outcome is not clearly documented or confirmed in the comments. The core problem appears to be related to conditional error message display logic within the widget code.",Stalled (no recent activity),"#1 johnchque: ""Gonna review this."" #49 mgifford: ""Correcting. This isn't a page level problem."" #50 mgifford: “This value should not be null.” #46 needs-review-queue-bot: “TheNeeds Review Queue Bottested this issue. It either no longer applies to Drupal core, or fails the Drupal core commit checks. Therefore, this issue status is now ""Needs work””",- [WCAG 1.1.1 Error Identification](https://www.w3.org/WAI/WCAG21/Understanding/error-identification.html): Guidance on appropriate error messaging. - [ARIA Specifications](https://w3.org/TR/wai-aria/): Relevant ARIA roles and states for form elements.
82751,Allow some HTML tags in node titles,Allow some HTML tags in node titles,https://www.drupal.org/project/drupal/issues/82751,drupal,Active,Major,field system,11.x-dev,19 years 3 months,3.1.2,3.1.2,"Users may experience difficulty understanding node titles if they contain excessive or improperly implemented HTML tags. This could lead to reduced comprehension and potentially impact navigation and content discovery, particularly for users employing assistive technologies.","The issue, as described, suggests allowing arbitrary HTML within node titles. This is a significant accessibility risk. Node titles should be clean, concise, and primarily text-based for optimal accessibility.","This longstanding accessibility issue regarding HTML formatting within node titles remains unresolved. The issue is currently stalled with minimal recent activity, and a clear path forward is lacking.","The core issue persists, as developers have consistently failed to implement HTML formatting support within the node title field. Despite numerous discussions (comments #82751-50 and #15311464), no technical solution or agreed-upon strategy has emerged. WCAG 2.2 Success Criteria 3.1.2 (Accessible Names and Labels) is demonstrably not being met.",Stalled (no recent activity),#82751-50 (pere orga): Re-iterated the need for this feature. #15311464 (mgifford): Added WCAG SC 3.1.2. #16037816 (yonailo): Asked for best practices.,- [WCAG 2.2 Success Criteria 3.1.2](https://www.w3.org/TR/WCAG22/): Accessible Names and Labels
3049122,Links in language switcher block do not conform to WCAG language-of-parts,Links in language switcher block do not conform to WCAG language-of-parts,https://www.drupal.org/project/drupal/issues/3049122,drupal,Active,Normal,language system,11.x-dev,6 years 8 months,3.1.2,3.1.2,"The language switcher block’s links are not appropriately labeled for screen reader users, potentially preventing them from correctly selecting their preferred language. This violates WCAG guidelines regarding the identification of interactive controls and language options, leading to a potentially frustrating user experience.","The issue describes a lack of proper labeling for links within a language switcher. To resolve this, ensure each language option within the switcher is represented by a `<button>` element. Each button should have clear, descriptive text reflecting the language it represents (e.g., “English”, “Spanish”).  Avoid using the link element for this purpose.  If the structure requires a visual switcher, use ARIA attributes judiciously. Specifically, use `aria-label` on the button to provide a concise description of the language option if the text is abbreviated or unclear.  Consider using the `aria-expanded` attribute on the language switcher element itself to indicate whether the dropdown is currently visible. Ensure sufficient color contrast between the text and background for all language options.  Prioritize semantic HTML; ARIA should only be used to augment, not replace, native HTML semantics.","The issue report indicates a misalignment between the language switcher block and WCAG language-of-parts guidelines. The issue has received minimal engagement, with only one participant requesting a replication step. No patches or resolutions have been identified.",Andrewmacpherson reported that links within the language switcher block do not conform to WCAG language-of-parts. The issue is tied to related Drupal issue #2454289 regarding hreflang attributes. No patches or technical solutions have been proposed or implemented.,Minimal engagement,#1 andrewmacpherson: Issue summary: View changes Related issues: #2454289 #7 mgifford: What's the best way to replicate this?I want to ensure it gets added herehttps://github.com/CivicActions/accessibility/blob/main/VPAT/Drupal9Acce...,- [WCAG 3.1.2 Language of Parts](https://www.w3.org/WAI/WCAG22/guidelines/3.1/language-of-parts.html) - [ARIA Specifications](https://www.w3.org/TR/wai-aria/)
3020305,The core language selector does not have a lang tag,The core language selector does not have a lang tag,https://www.drupal.org/project/drupal/issues/3020305,drupal,Needs work,Normal,language system,11.x-dev,7 years 1 week,3.1.2,3.1.2,The absence of a `lang` attribute on the language selector may impact users relying on screen readers for content localization. This can lead to incorrect language detection and a degraded user experience when the website supports multiple languages.,"The issue report correctly identifies a missing `lang` attribute on the core language selector. This attribute is crucial for screen readers to accurately identify the language of the content. The recommended solution is to add the `lang` attribute directly to the HTML element representing the language selector.  Specifically, add `lang=""en""` (or the appropriate language code) to the `<select>` element.  This is a fundamental requirement for WCAG 2.2 Level AA compliance.  Do *not* use ARIA attributes to attempt to solve this; using the `lang` attribute on the native `<select>` element is the correct and preferred approach. Consider the use of a consistent and clearly labeled language selector that aligns with established web accessibility patterns.","The core language selector lacks a lang tag, preventing proper accessibility support for multilingual users. While a series of patches have been proposed and implemented, the issue remains unresolved and requires further review and testing.","The core language selector does not include a lang attribute, potentially impacting accessibility for users who require language-specific content or assistive technologies. Multiple patches have been submitted (11, 12, 14) attempting to address this, with Akshay Kelotra initially proposing a fix and subsequent revisions by the team. However, the issue persists, and no tests have been executed to confirm the implementation’s effectiveness.",Minimal engagement,"#1 julenmelgar: Created issue and reported the missing lang tag. #2 akshay.kelotra: Provided a patch (lang-attribute-in-language-selector-3020305-2.patch) addressing the issue. #3 akshay.kelotra: Changed status to ""Needs review"" after updating patch for Drupal 8.7.x-dev. #17 themusician: Reviewed and tested the patch and confirmed the lang attribute is present after the code changes.",- [WCAG 1.1.1 Non-text Content](https://www.w3.org/WAI/WCAG21/criteria-1.1/): Relevant success criterion. - [ARIA Language Attribute](https://www.w3.org/WAI/ARIA/apg/image-roles.html): Information on the role of the lang attribute in ARIA.
3300836,Untranslatable fields do not respect language of parts,Untranslatable fields do not respect language of parts,https://www.drupal.org/project/drupal/issues/3300836,drupal,Active,Normal,language system,11.x-dev,3 years 4 months,3.1.2,3.1.2,"Users may encounter confusion if untranslated fields are displayed alongside translated content, particularly when relying on assistive technologies to interpret the page structure. This disrupts the expected flow of information and can lead to a degraded user experience.",The issue description indicates a problem where untranslated fields are not appropriately adapting to the selected language. This suggests a misinterpretation of the part-based translation system. The core accessibility concern is that the presentation of these fields doesn’t align with the user’s language preference.,"The issue reports that untranslated fields do not respect the language of parts, specifically when a site is translated into Spanish but the body text remains in English. Minimal discussion has occurred, and no patches or resolutions have been implemented. The issue is currently stalled with no recent activity.","Charles Belov reported that untranslated fields don't respect the language of parts. Charles Belov clarified that if the site is in English, but the body text is translated to Spanish, the body field needs a lang=""en"" attribute. Minimal discussion has occurred around this issue.",Minimal engagement,#1 by charles belov: Created issue and described the problem. #2 by mgifford: Provided further clarification and referenced WCAG 2.2 Success Criterion 1.1.1. #4 by charles belov: Improved the issue description. #5 by charles belov: Improved the issue description. #6 by charles belov: Improved the steps.,- [WCAG 2.2 Success Criterion 1.1.1 Non-text Content](https://www.w3.org/WAI/WCAG22/criteria/success-1.1.1): Relevant criterion for non-text content.
2496223,Views containing content not in the page's language need to add tags which mark the language of parts,Views containing content not in the page's language need to add tags which mark the language of parts,https://www.drupal.org/project/drupal/issues/2496223,drupal,Active,Normal,views.module,11.x-dev,10 years 7 months,3.1.2,3.1.2,Users encountering views with content in a different language than the page's primary language may experience difficulty understanding the information presented. The absence of language tags associated with specific content sections creates a barrier to comprehension for users who prefer or require content in their language of choice.,The issue describes a need to explicitly indicate the language of content segments within views. This is crucial for supporting localization and ensuring users can access content in their preferred language.  The recommended approach prioritizes semantic HTML.,"The issue reports that views containing content in a different language need language attributes added to the parts, aligning with WCAG 3.1.2. The issue is currently active but stalled due to a postponement related to 8.1 releases. The next step is to add the specified language tags.","The issue describes a situation where views displaying non-English content lack the necessary language attributes. Charles Belov identified this requirement, stating that language attributes should be applied to non-English content within views. The discussion highlights the importance of adhering to WCAG 3.1.2: Language of Parts.",Minimal engagement,"#3 charles belov: Issue summary:View changesImproved description of issue. #4 charles belov: That's actually a different issue.If an English view is displaying non-English content, then there needs to be language attributes surrounding the non-English content. (This issue)If a non-English node has untranslated content, then there needs to be language attributes surrounding the En #19 mgifford: Issue tags:+i18n",- [WCAG 3.1.2: Language of Parts](https://www.w3.org/WAI/WCAG21/criteria-3/3.1.2): Official WCAG criterion. - [ARIA specifications](https://w3.org/TR/wai-aria): Relevant for assistive technology support.
