Issue ID,Issue Title,Description,Issue URL,Project,Status,Priority,Component,Version,Created,wcag_sc,ai_wcag,acr_note,dev_note,thread_tldr,thread_problem,thread_sentiment,thread_timeline,thread_links
2922435,"""Add new comment"" and ""@count comments"" links are not following accessibility good practices","""Add new comment"" and ""@count comments"" links are not following accessibility good practices",https://www.drupal.org/project/drupal/issues/2922435,drupal,Needs work,Normal,comment.module,11.x-dev,8 years 1 month,2.4.4,2.4.4,Users may experience difficulty accessing the comment count and new comment functionality due to the lack of proper accessibility implementation. This potentially limits users’ ability to fully engage with the content and contribute meaningfully.,"The issue description indicates a lack of adherence to accessibility best practices for the “Add new comment” and ""@count comments"" links.  The primary focus should be on leveraging semantic HTML.","The ""Add new comment"" and ""@count comments"" links exhibit accessibility issues, primarily related to lack of context for screen reader users. A patch was submitted to add visual context, but testing is lacking and the issue remains open, awaiting review and testing.","DuaelFr reported accessibility issues with the “Add new comment” and ""@count comments” links, seeking appropriate contextual information for screen readers. A patch (MR 2922435) was created by DuaelFr to add the phrase “About Blah” to the links.  BarisW subsequently updated the patch to support the key (@title) in the ""Add new comment"" link for the accessibility issue (WCAG 2.4.4).  However, no further activity has been recorded beyond this, and the issue is currently stalled.",Minimal engagement,"#1 DuaelFr: Initial report - “Add new comment” and ""@count comments"" links not following accessibility good practices. #2 DuaelFr: Submitted patch (MR 2922435) to add contextual information. #3 BarisW: Updated patch to include key (@title) in the link text. #4 mgifford: Added SC for 2.4.4 (WCAG 2.4.4) #5 DuaelFr: Confirmed MR 3455 #6 deepakwerma: Made their first commit to the issue's fork #7 deepakwerma: Changed the visibility of the branch2922435-add-new-commenttohidden. #8 smustgrave: Requested an update for 10.1 or a separate one. #9 DuaelFr: Confirmed MR 3455",- [WCAG 2.4.4 – Link Purpose in Context](https://www.w3.org/WAI/WCAG21/Understanding/link-purpose-in-context):  Details the success criteria for providing link purpose information. - [WCAG 2.2 Level AA](https://www.w3.org/TR/WCAG22/): Sets the standard accessibility conformance level.
3331158,Support full-screen editing in CKEditor,Support full-screen editing in CKEditor,https://www.drupal.org/project/drupal/issues/3331158,drupal,Reviewed & tested by the community,Major,ckeditor5.module,11.x-dev,2 years 11 months,3.3.6,3.3.6,Users who require a distraction-free editing environment may find the absence of a full-screen mode a barrier to efficient content creation. This limitation could impact users with cognitive disabilities who benefit from focused workspaces and reduced visual distractions.,"The request for full-screen editing in CKEditor necessitates careful consideration of accessibility. Initially, evaluate if a modal dialog with maximized dimensions can adequately address the need. If this is insufficient, focus on ensuring the editor's content remains accessible within the modal. This involves: 1) Using semantic HTML for the modal’s content area (e.g., `<article>` or `<main>`). 2) Applying appropriate ARIA attributes *only* to enhance the experience when native HTML doesn’t provide sufficient context. Specifically, use `role=""dialog""` on the modal and `aria-modal=""true""` to communicate its modal nature. Ensure focus management within the modal using appropriate `tabindex` values and keyboard navigation. Consider using keyboard shortcuts for full-screen activation and exit.  Avoid adding unnecessary visual styling that might cause focus issues or negatively impact screen reader users.  Reference CKEditor’s documentation for modal implementation best practices, and consult WAI-ARIA 1.2 for proper attribute usage.","The issue relates to the CKEditor full-screen mode, which appears to be functional but lacks clear accessibility controls and documentation. The community is currently awaiting a maintainer to review and refine the implementation.","Initial report (#1) indicates users are encountering difficulties using the CKEditor full-screen mode, specifically regarding keyboard navigation and screen reader compatibility.  #2, godotislate, has confirmed the issue locally and provided a screenshot.  #3, smustgrave, suggests a potential duplicate module exists in the CKEditor plugin repository. No further testing or refinement activity has been observed.",Minimal engagement,#1 smustgrave: Reported the issue. #2 godotislate: Confirmed the issue locally and provided a screenshot. #3 smustgrave: Suggested a potential duplicate module.,- [WCAG 2.1.1 Keyboard Accessibility](https://www.w3.org/WAI/WCAG21/Understanding/keyboard-keys-accel-nav): Relevant accessibility guideline.
3443571,Mobile version of Navigation should have focus trap,Mobile version of Navigation should have focus trap,https://www.drupal.org/project/drupal/issues/3443571,drupal,Needs work,Major,navigation.module,11.x-dev,1 year 8 months,2.4.11,2.4.11,"The mobile navigation lacks a focus trap, potentially preventing keyboard users from easily accessing and navigating the site's content. This creates a barrier for users who rely on keyboard input, impacting their ability to effectively use the website.","The request for a “focus trap” on the mobile navigation suggests the user wants to prevent keyboard focus from escaping the navigation menu while a user is actively using the keyboard to navigate.  This is typically achieved using the `tabindex` attribute, but it’s crucial to use this sparingly and only as a last resort.  The first step is to ensure the mobile navigation is logically structured with clear headings and sufficient keyboard focus order.  Specifically, ensure that the navigation items are focusable via the `Tab` key.  If focus *does* escape the navigation on mobile, consider using `tabindex=""0""` on the navigation element and then carefully control the tab order using the `tabindex` attribute.  Apply `tabindex=""0""` only to the navigation container and ensure it is the *first* element in the tab order. Test thoroughly with keyboard-only navigation to confirm the expected behavior.  Avoid using `tabindex` excessively as it can disrupt the natural tab order and create confusion for users.  Prioritize semantic HTML for keyboard navigation.","The mobile navigation focus trap is reported but lacks a concrete solution. Mherchel has abstracted the logic to core level, awaiting review and potential integration with existing arrow navigation.","mherchel reported the need for a focus trap within the mobile navigation. Finnsky suggested merging with existing arrow navigation logic or moving it to core. Mherchel has abstracted the code to core, awaiting review. No patches or tests have been implemented. WCAG 2.4.11 Focus Not Obscured (Minimum) is referenced.",Minimal engagement,"#1 mherchel: Reported the issue. #8 mherchel: Suggested moving the logic to core. #11 mherchel: Reaffirmed the suggestion, stating it's achievable.",- [WCAG 2.4.11 Focus Not Obscured](https://www.w3.org/WAI/WCAG22/guidelines/general/ug-fl.html) - [ARIA Specifications](https://www.w3.org/TR/wai-aria/)
3541728,Submenu opened with hover does not close by Escape key when another menu item has focus,Submenu opened with hover does not close by Escape key when another menu item has focus,https://www.drupal.org/project/drupal/issues/3541728,drupal,Active,Major,navigation.module,11.x-dev,4 months 6 days,2.1.1,2.1.1,"Users attempting to close a hover-opened submenu using the Escape key while another menu item has focus may experience difficulty. The current behavior prevents the submenu from closing, potentially leading to a frustrating and inaccessible user experience.",This issue indicates a conflict between focus management and keyboard navigation within the submenu. The core problem is that the Escape key’s default behavior to close an element is being overridden when another focusable element exists within the page.,"The issue is a submenu that does not close with the Escape key when another menu item has focus, preventing keyboard accessibility. Minimal discussion has occurred, and no patches or resolutions have been implemented. The next step is a review of the code to address the keyboard interaction.",kentr reported that a submenu opened with a hover does not close with the Escape key when another menu item has focus. Kentr added an issue summary and proposed resolution. No patches or PRs have been created. This relates to WCAG 2.2.1 Keyboard Accessibility.,Minimal engagement,#1 kentr: Issue summary: View changes Adding proposed resolution. #2 kentr: Issue tags:+Accessibility #3 kentr: Issue tags:+Accessibility,- [WCAG 2.2.1 Keyboard Accessibility](https://www.w3.org/WAI/WCAG22/guidelines/keyboard-accessibility.html)
3541910,Elements in closed sidebar are focusable,Elements in closed sidebar are focusable,https://www.drupal.org/project/drupal/issues/3541910,drupal,Needs work,Major,navigation.module,11.x-dev,4 months 5 days,2.1.1,2.1.1,Users relying on keyboard navigation may be unable to access content within a closed sidebar. The lack of focusability prevents users with motor impairments or those navigating with assistive technologies from interacting with the sidebar’s elements.,"The reported issue indicates that elements within a closed sidebar are currently focusable, which violates WCAG 2.2 accessibility guidelines. The primary solution is to ensure that these elements are *not* focusable when the sidebar is closed. This can be achieved through several methods, prioritizing semantic HTML:","The issue of focusable elements in closed sidebars has been partially resolved. A fix was implemented by shqshqnk to hide navigation links when the sidebar is collapsed, but a remaining issue exists regarding focus behavior on screen width changes in DevTools.","Initial report identified focusable elements within the closed sidebar. shqshqnk implemented a fix by adding `visibility: hidden` to the navigation links when the sidebar is collapsed, addressing the immediate issue. However, sandip reported that the toggle triggers function doesn't run on screen width change in DevTools.",Minimal engagement,#1 kentr: Created issue. #6 shqshqnk: Fixed visibility issue with screenshots. #19 sandip: Investigating DevTools toggle issue.,- [CSS Transitions](https://developer.mozilla.org/en-US/docs/Web/HTML/Reference/Global_attributes/style): Relevant to the animation workaround suggested. - [ARIA Practices](https://www.w3.org/WAI/ARIA/apistandard): Related to focus management and accessibility.
2942404,Messages should have role=status instead of role=contentinfo,Messages should have role=status instead of role=contentinfo,https://www.drupal.org/project/drupal/issues/2942404,drupal,Needs work,Normal,markup,11.x-dev,7 years 10 months,1.3.1,1.3.1,"Users relying on screen readers may experience difficulty understanding the status of messages if the `role=""status""` attribute is not correctly applied. The current use of `role=""contentinfo""` does not convey the intended meaning of a message’s state (e.g., success, error, warning) to assistive technologies, potentially leading to a confusing user experience.","The core issue here is the correct semantic markup for a message indicating a status update.  `role=""status""` is the appropriate ARIA role to use when a message represents a status update or notification.  This clearly communicates the element's purpose to assistive technologies.","The system messages block is failing to announce due to a lack of proper ARIA attributes, specifically the role=status and aria-atomic attributes, resulting in accessibility issues for screen reader users when the page reloads. The latest attempted solution by thamas involved adding the role and aria attributes to the block’s template, but it was not tested. The issue is stalled with no recent activity.","Initial report only. cwilcox808 and thamas have identified that the system messages block is not properly announced after a page reload, which is a significant change in context for screen reader users.  The existing content of a live region is not announced after page reload (as that is not a content change of an existing page) per WCAG 2.2. Success Criterion 2.4.6 (Timeed Communication) may be relevant.",Minimal engagement,#1 thamas: Reported the issue and initial attempt to fix it. #2 cwilcox808: Confirmed the issue and clarified the context change. #3 thamas: Updated the block template with role=status and aria-atomic.,- [WCAG 2.2.6 Timeed Communication](https://www.w3.org/WAI/WCAG22/Understanding/timeed-communication.html) - [ARIA 1.1.1 Live Regions](https://www.w3.org/TR/wai-aria/livereg#live-region)
3073895,"System Menu blocks placed via Layout Builder can generate duplicate, invalid HTML ID attributes","System Menu blocks placed via Layout Builder can generate duplicate, invalid HTML ID attributes",https://www.drupal.org/project/drupal/issues/3073895,drupal,Needs work,Normal,layout_builder.module,11.x-dev,6 years 4 months,General,General,"System Menu blocks utilized within Layout Builder may result in duplicate HTML ID attributes. This could potentially lead to confusion for assistive technology users as the system may incorrectly interpret the duplicate IDs, impacting navigation and screen reader behavior.","This issue likely stems from the Layout Builder’s method of generating IDs for System Menu blocks. The core problem is the potential for duplicate `id` attributes, violating HTML5 specification requirements.  The recommended fix prioritizes semantic HTML.","The issue is a duplicate HTML ID attribute issue with Layout Builder, potentially causing link navigation problems. The community is stalled with no recent activity and a proposed fix is awaiting a CR.","The issue reports duplicate, invalid HTML ID attributes generated by Layout Builder when using System Menu blocks. Initial discussion centered around the potential for broken in-page links. daddison recently updated the twig template to use `clean_unique_idtwig` and added test coverage.",Stalled (no recent activity),#1 daddison: made their first commit to this issue’s fork. #2 daddison: I updatedhttps://git.drupalcode.org/project/drupal/-/merge_requests/6965to use|clean_unique_idtwig filter in the block  and updated test coverage. #3 smustgrave: Original concern of updating the the twig templates directly is back. We will need a CR as contrib and custom themes won't have that change.,- [WCAG 2.2 Level AA](https://www.w3.org/WAI/WCAG22/): Accessibility guidelines. - [ARIA specifications](https://w3.org/TR/wai-aria/): Accessible Rich Internet Applications.
